|city|job_title|company_name|location|summary|salary|link|summary_full
33|New+York+NY|Senior Associate, Data Scientist/Statistics - Financial Services|KPMG|New York, NY 10261|Machine learning, data visualization, statistical modeling, data mining, or information retrieval. Experience with command-line scripting, data structures and...||https://www.indeed.com//pagead/clk?mo=r&ad=-6NYlbfkN0CzN6uX84z9wq8HaOCWH9ZvJLeemKyVc3gCGVrPSg-ucKoPSUpfOYdwB0JQpoDjiKgxAB0GeP9CVesAraHbDNvnYpr5L6zfXvLrLgW5vOgAi-TsG-ObKUp-9-ahAlJJpzgSROtspAS3FOOgmRlenKeUDnBdMues4BdEkeNmbCJB4OIZXkOyaERtaDVzSofUIhUMJNIref7mCWJejSACaJcj2lWAD5v9FtDMG-CPuZZMGGJdUM6UWLsyakQj7TCmqM6cc8LrUf3Efg7Cv8p4Whkvx2byAFz6VqIy5o9Ogui9qM2ZDxCbnAU_bwMC1WeYIZZwREHPFe7PW6dSCAT_hhXSm_rkEV9lIJaRd3vX6pw5O5hVnisO9qjOYFtNAEqF23IUnu0HylaQub8Tp3J6I-F7EgNguv15Svo=&vjs=3&p=2&sk=&fvj=0|"[Known for being a great place to work and build a career, KPMG provides audit, tax and advisory services for organizations in today’s most important industries. Our growth is driven by delivering real results for our clients. It’s also enabled by our culture, which encourages individual development, embraces an inclusive environment, rewards innovative excellence and supports our communities. With qualities like those, it’s no wonder we’re consistently ranked among the best companies to work for by Fortune Magazine, Consulting Magazine, Working Mother Magazine, Diversity Inc. and others. If you’re as passionate about your future as we are, join our team.
KPMG is currently seeking a Senior Associates, to join our Advanced Data Analytics Organization within the Financial Services Industry. Applicants must be currently authorized to work in the United States without the need for visa sponsorship now or in the future
Responsibilities:
Analyze and model structured data using advanced statistical methods and implement algorithms and software needed to perform analyses
Build recommendation engines, spam classifiers, sentiment analyzers and classifiers for unstructured and semi-structured data
Cluster large amount of user generated content and process data in large-scale environments using Amazon EC2, Storm, Hadoop and Spark
Perform machine learning, natural language, and statistical analysis methods, such as classification, collaborative filtering, association rules, sentiment analysis, topic modeling, time-series analysis, regression, statistical inference, and validation methods
Participate in client engagements focused on big data and advanced business analytics, in diverse domains such as product development, marketing research, public policy, optimization, and risk management; communicate results and educate others through reports and presentations
Perform explanatory data analyses, generate and test working hypotheses, prepare and analyze historical data and identify patterns
Qualifications:
A minimum of three years of professional experience working as a Data Scientist
Masters degree or PhD from an accredited college/university in Computer Science, Statistics, Mathematics, Engineering, Bioinformatics, Physics, Operations Research, or related fields, with a strong mathematical background and ability to understand algorithms and methods from a mathematical viewpoint and an intuitive viewpoint
Experience with command-line scripting, data structures and algorithms and ability to work in a Linux environment, processing large amounts of data in a cloud environment
Strong knowledge in at least one of the following fields: machine learning, data visualization, statistical modeling, data mining, or information retrieval
Strong data extraction and processing, using MapReduce, Pig, and/or Hive preferred
Ability to travel up to eighty percent of the time
KPMG LLP (the U.S. member firm of KPMG International) offers a comprehensive compensation and benefits package. KPMG is an equal opportunity employer. All qualified applicants are considered for employment without regard to race, color, creed, religion, age, sex/gender, national origin, ancestry, citizenship status, marital status, sexual orientation, gender identity or expression, disability, physical or mental handicap unrelated to ability, pregnancy, veteran status, unfavorable discharge from military service, genetic information, personal appearance, family responsibility, matriculation or political affiliation, or other legally protected status. KPMG maintains a drug-free workplace. KPMG will consider for employment qualified applicants with criminal histories in a manner consistent with the requirements of applicable local, state or federal law (including San Francisco Ordinance number 131192). No phone calls or agencies please.]"
34|New+York+NY|Digital Data Scientist|JP Morgan Chase|New York, NY 10001 (Chelsea area)|Data Scientist – Applied Machine Learning. Digital Intelligence Data Scientist – Applied Machine Learning. We are currently looking for a data scientist who is...||https://www.indeed.com//rc/clk?jk=1b94541d8c3e69e5&fccid=c46d0116f6e69eae&vjs=3|"[Digital Intelligence
Data Scientist – Applied Machine Learning
JPMorgan Chase Consumer and Community Banking (CCB) serves 50 million customers with a broad range of consumer financial services, including personal banking, investment advice, small business lending, mortgages, credit cards, payments and auto financing. Our 160,000 employees serve our customers by following Chase's Five Keys to A Great Customer Experience.

As a JPMorgan Chase & Co employee, you'll be part of a company that makes a real difference every day for our customers, our communities and ourselves. With a focus on customer service, you'll put others first, do what's right and create solutions that make lives better. We invite you to build your career on our strong foundation and help shape what's next - for you and for us.
At JPMorgan Chase & Co, we have undertaken an aggressive digital transformation initiative, which builds on the success of our current mobile and online service offerings. We are investing in innovative ways to deepen customer engagement, satisfaction and profitability through the use of digital channels. The ambition is to position Chase as the undisputed leader in digital financial services and payments, and to enable delivery of highly personalized, real-time experiences that customers increasingly expect. To achieve this, we are currently recruiting a world-class team to build out our next-generation digital platform and capabilities. We think of ourselves as a start-up within the firm and we are building many capabilities from scratch using the latest technologies
Digital Intelligence Data Scientist – Applied Machine Learning
The Digital Intelligence team turns the firm’s billions of credit and debit transactions, clickstream events, and other datasets, into useful insights and proprietary data products to deeply personalize the digital experience of our millions of customers. Whether it’s building a social media-style graph of our consumers and merchants, optimizing ad targeting on Chase.com/paid-media search, recommending the most relevant hotels on our rewards website or detecting fraudulent behavior in our digital platform, we work at the intersection of statistics, machine learning, artificial intelligence and engineering to tackle some of the most challenging and interesting problems you will find in digital banking, targeting, commerce and payment. Many companies claim that they have “big data”. We live and breathe it every day.
We are currently looking for a data scientist who is passionate about solving real-world business problems using Machine Learning/Artificial Intelligence techniques. You will be designing, developing and deploying large-scale Machine Learning systems using our rich online and offline datasets and a wide variety of big data tools.
This is not a role for everyone and we have a high bar. We are looking for those select few who thrive in a dynamic environment, have big ideas and goals, and believe in testing ideas rather than talking about them. They pride themselves at being curious and generalists, able to tackle any problem that comes their way. They love building data products and production-grade models without needing an army of engineers, and love learning new skills along the way. They feel comfortable working with a diverse group of colleagues, e.g. designers, product managers, business analysts and engineers. You will be joining one of the most elite data science teams we have assembled on Wall Street: several of us have worked at Internet and start-up companies before joining the team. You will work on some of the most fascinating and challenging problems, work with the latest technologies, and will enjoy working with colleagues who are just as passionate and curious as you.
Masters expected, PhD preferred in Computer Science, Computer Engineering, Machine Learning or Artificial Intelligence
2+ years of industry experience in building large scale end-to-end machine learning systems using a combination of big data tools and programming languages like Scala, Java and/or Python
Knowledge of parallel and distributed computing frameworks such as Hadoop, Spark, MPI, using GPUs
Experience in machine learning areas such as recommender systems, NLP, pattern recognition, predictive modeling, Artificial Intelligence
Experience implementing machine learning algorithms such as support vector machines, decision trees, logistic regression, clustering, neural networks, graphical models etc., or extending open-source libraries such as Mahout, Spark MlLib, GraphLab etc.
You are curious, have a research mindset, love bringing logic and structure to loosely defined unstructured problems and ideas.
You hold yourself and your colleagues to a high bar, and take great pride in your attention to details. You inspire us to aim higher.
You are resilient, fearless, passionate, and creative.]"
35|New+York+NY|Statistical Analyst/Data Scientist (Machine Learning)|Medidata Solutions|New York, NY 10003 (Greenwich Village area)|The Medidata Clinical Cloud® is the primary technology solution powering clinical trials for 18 of the world's top 25 global pharmaceutical companies and is...||https://www.indeed.com//rc/clk?jk=87f418e45b804fde&fccid=3e34ac4ae73849ba&vjs=3|"[Our Industry: Where we play
Medidata is making a real difference in the lives of patients everywhere by accelerating critical drug and medical device development. Our work ensures that life-saving drugs and medical devices get to market faster. We are a certified “Great Place to Work” with highly engaged employees focused on improving the health outcomes of patients across the globe.

We develop cloud-based enterprise products and services and are a world leader driving the convergence of the Technology and Life Sciences industries, one of the most exciting areas for innovation globally. With annual revenue in 2016 of nearly $500 million, we are publicly traded (MDSO) with over 850 customers and customer retention rates above 99%. The Medidata Clinical Cloud® is the primary technology solution powering clinical trials for 18 of the world's top 25 global pharmaceutical companies and is used by 18 of the top 25 medical device developers—from study design and planning through execution, management and reporting. Our customers include global pharmaceutical companies, biotech, diagnostic and device firms, leading academic medical centers, technical partners and contract research organizations.

By automating over 12,000 clinical trials to date, Medidata has the largest collection of clinical trial data in the world. Today, Medidata pioneers innovative, advanced applications and intelligent data analytics, bringing a new level of quality and efficiency to clinical trials. That means better treatments reach waiting patients sooner.

We know that diverse teams win. It is our diversity and inclusiveness that fuels innovation and sparks our passion and commitment to patient health. We are still led by our Co-founders, Tarek Sherif and Glen de Vries, and have global operations in US, Europe and Asia with over 1900 employees.

Your Mission:

This position will research and develop statistical models within the data science group at Medidata.

Your Competencies:
Design, develop and validate statistical models for novel medical applications. Areas of team focus include mHealth, genomics, and other projects in support of design, analysis, and meta-analysis of clinical trials.Provide support functions around model-building, including data cleaning and code reviewProductionalize developed methods and code for integration with existing/new productsReport findings to internal teams and clients

Skills/Requirements:
Proficiency in R, Python and/or SAS languagesStrong verbal and written communication; collaborative focusExperience using Git version control

Your Education & Experience:
Ph.D. or Masters in statistics or data science, or in related field with strong foundation in statistical methodology2+ years of experience with statistical analysis in a healthcare related field is desired




Our Culture: Who we are
We know that creativity doesn't happen on-demand. Developing cutting-edge cloud technology takes great minds and talented people working together in a collaborative environment. That is why we are committed to fostering an innovative, agile company culture. We encourage our teams to come together and experiment with new concepts, research new approaches and test out new technologies. We believe that being part of our team will make a difference in the world.

Our Mission: Powering smarter treatments and healthier people.
Our Vision: To be the most innovative cloud company in Life Sciences.
Our Principles: Integrity, Partnership, Inventiveness, Humility, Nimbleness, Tenacity, Inclusiveness, and Caring.
Our Leadership Drivers:
THINK: Inspires purpose, articulates strategy, and simplifies complexityTEAM: Communicates effectively, builds relationships and collaborates with othersDO: Plans ahead, scales for growth, ensures accountabilityLEARN: Self-aware, values difference, strives to learnTEACH: Inspires work, coaches others, builds teams

EEO Statement

US:
Medidata Solutions, Inc. is an Equal Opportunity Employer. Medidata Solutions provides equal employment opportunities to all employees and applicants for employment without regard to race, color, religion, gender, sexual orientation, gender identity, national origin, age, disability status, protected veteran status, or any other characteristic protected by the law. Medidata Solutions complies with applicable state and local laws governing non-discrimination in employment in every location in which the company has facilities.

#LI-AS1]"
36|New+York+NY|Data Analyst / Data Scientist|Defined Clarity|New York, NY|Must be able to write SQL queries and must have experience with data extraction. We have a client that is looking for a data scientist to add to its team....||https://www.indeed.com//rc/clk?jk=17edf4f45397c435&fccid=fd3bad61fc50422e&vjs=3|"[We have a client that is looking for a data scientist to add to its team. This position is for a Fortune 50 company that is based in Philadelphia. This is not a remote position.
Expertise in SQL Development.Call Center or Customer care data experience a plus.Must be able to write SQL queries and must have experience with data extraction
and ETL.
Experience with Teradata and SQL Server DatabasesR Studio and Python scripting is a plus.Communication and presentation skills are a must as you will have to present to key stakeholders.Tableau analysis and dashboard development is required. A minimum of three years professional-level SQL programming experience in a
Windows and Linux environment.
A Computer Science or Mathematics degree.Outstanding problem-solving skills.Ability to develop and deliver power point presentations.Knowledge of shell scripts and other languages including Java, Python or Perl is a
plus.]"
37|New+York+NY|Data Scientist, Monetization Analytics|SoundCloud|New York, NY 10003 (Greenwich Village area)|Our Data Scientists are using evidence in order to inform decisions across the organization and to build engaging, personally relevant experiences for our users...||https://www.indeed.com//rc/clk?jk=50beed552437a797&fccid=af61bf95b89c7cb2&vjs=3|"[We’re looking for Data Scientists to join our Data Science team with a focus on supporting teams that are responsible for revenue delivery through advertising and subscriptions. Our Data Scientists are using evidence in order to inform decisions across the organization and to build engaging, personally relevant experiences for our users.
About the role]"
38|New+York+NY|Data Scientist|Kasisto|New York, NY|The position’s responsibilities will include developing scalable systems for storing, moving, analyzing, and training machine learning algorithms using large...||https://www.indeed.com//company/Kasisto/jobs/Data-Scientist-7d05fb97ba535a1c?fccid=0160df68c4a70059&vjs=3|[Kasisto, a FinTech startup, is on a mission to enable companies to attract, engage, support, and transact with their customers via human-like, intelligent conversations, anytime, anywhere. Kasisto’s conversational AI platform, KAI, powers omni-channel bots and virtual assistants with deep domain expertise across mobile apps, web, messaging platforms, and IoT devices.Built with the deepest AI portfolio in the industry, KAI is an enterprise-ready platform with self-service tools to customize and continually improve consumer experiences and seamlessly add new features. The agile, modern platform saves companies time and money with easy customization, simple APIs and modern SDKs, deep learning, security and compliance, and fast deployment.Some of the world’s most innovative financial institutions license KAI Banking including DBS Bank, Mastercard, Standard Chartered, TD Bank, Wells Fargo, among others. They are creating entirely new experiences to fulfill requests, solve problems, and predict needs for their customers with KAI-powered bots and assistants.This positionWe are looking for an experienced data engineer/scientist to assist in the development and improvement of our data storage, processing, and evaluation systems. The position’s responsibilities will include developing scalable systems for storing, moving, analyzing, and training machine learning algorithms using large amounts of natural language text data.You should have the ability to work independently within a small, creative, deadline-driven environment. This is an excellent opportunity for someone looking to grow professionally within a fast-moving tech startup with a global reach.What you will be doingDeveloping and improving existing infrastructure for data storage, transfer, and analysisWorking with NLP and machine learning-focused engineers to build new systems for model training and evaluationBuilding and improving data aggregation for performance monitoring dashboards deployed to customersYou should have the ability to work independently within a small, creative, deadline-driven environment. This is an excellent opportunity for someone looking to grow professionally within a fast-moving tech startup with a global reach.What you need in this position3+ years professional experience with data engineering, data science, and/or database administrationBachelor’s degree or higher in computer science, data science, or related fieldExperience with natural language processing and/or machine learning applications a plusStrong familiarity with SQL databases, especially PostgreSQLStrong proficiency in Java; Python or Scala experience a plusLocation – New York City, Flatiron DistrictJob Type: Full-timeSalary: $120,000.00 to $140,000.00 /yearExperience:Data Mining: 3 years (Required)]
39|New+York+NY|Senior Data Scientist, Product|Morgan Stanley|New York, NY 10032 (Washington Heights area)|Required• Understanding and defining what a minimally viable data science product is and how to reach an actionable end state with an economy of effort•...||https://www.indeed.com//rc/clk?jk=2c13936d4daef592&fccid=0c39fb2c91742dcf&vjs=3|"[The Data Management Organization (DMO) is leading the charge on data strategy and management in MS Research. Given the growing strategic importance of data, the Research DMO is a key enabler to both the “Offense” (generating new commercial opportunities) and “Defense” (ensuring proper data use and risk management).

The group is seeking an experienced and business minded Data Scientist to drive product development and enhancement efforts. The role is dynamic, fast paced and interacts with multiple stakeholders.

Responsibilities would include: • Prototype: Design and prototype ideas, run experiments using advanced analytical techniques, and iterate on new commercial products by partnering closely with product management, sector experts and technology • Data Quality: Establish data preparation standards in collaboration with other team members and oversee implementation across staff to ensure a strong data foundation for current and future products• Investigate: Identify data quality problems in current products and work with the DMO, Governance Council and sector teams to scope-out the solution and determine pipeline prioritization• Thought Leader: Collaborate with other data oriented individuals across the firm to teach and learn new technology and techniques and test new methodologies to embed into existing and new products • Roadmap: Partner with DMO Management to drive the Morgan Stanley Research data management vision and define the related data and analytics roadmap • Talent Development: Recruit junior data scientist/quant team member and develop them through training, knowledge sharing practices and career development

Technical Qualifications• Master’s degree in a quantitative field that could include but not limited to Computer Science, Math, Physics, Statistics and Engineering• 5+ years of experience in an industry setting (technology company, consulting, investment banking, etc.)• 3+ years of leadership experience in managing a team and advanced analytics projects (end-to-end from conception through implementation) • Application of data science techniques to develop data driven solutions in a business context• Expert command of statistical analysis, algorithm development, and state-of-the-art tools and methodologies for data science• Strong programming skills in multiple languages (Python, R, SQL, etc.)
Required• Understanding and defining what a minimally viable data science product is and how to reach an actionable end state with an economy of effort• Excellent analytical, problem solving and project delivery skills• Skills to effectively lead project teams that include a mix of data oriented roles (data analysts, data scientists, quants) and to act as a data science expert within the team• Excellent communication of statistical concepts to expert & non-expert audiences• Experience in data sourcing, data capture, data transformation and data preparation techniques•Ability to collaborate across a broad set of stakeholders from different functions (i.e., Business, IT, Operations) •Experience in attracting, managing, and growing high-performing teams• Ability and desire to work in a start-up paced environment and culture]"
40|New+York+NY|Machine & Deep Learning Data Scientist Internship|Crushh|New York, NY|This data science internship is unique opportunity to gain hands-on experience in machine learning and explore deep learning and neural networks....||https://www.indeed.com//company/Crushh/jobs/Machine-Deep-Learning-Data-Scientist-Internship-6d58990dbb0a8cbe?fccid=e669b2a98ea7cb04&vjs=3|[Job SummaryCrushh is a unique mobile app (www.crushhapp.com) that analyzes texts messages and interprets how the people in the conversation feel about each other. This data science internship is unique opportunity to gain hands-on experience in machine learning and explore deep learning and neural networks.Responsibilities and DutiesWe are looking for a bright intern who is passionate about learning and developing skills in AI and data analysis. You will develop and refine a wide range of prediction algorithms using python and explore open source tools in natural language processing. You will help implement applications that may be incorporated into our live app.This position requires you to work in our office in Manhattan, NY. You will be paid an hourly wage of $12.00/hr and work about 20 hours per week, 3 days a week.Qualifications and SkillsRequirements:Major or equivalent coursework in math, statistics, computer science, engineering, or NLPProgramming experience with PythonFamiliarity with SQLFamiliarity with statistics software (Matlab, R, etc.)Good communication and writing skills as you will be working closely within a small teamPreferred (but not required):Applied experience using deep learningExperience in research techniques and optimizing AI algorithmsExperience with DjangoFamiliarity with open source toolkits and librariesLong cover letter not required, but give us a sense of why you want to get into machine learning and what you have already done to demonstrate your interest. Please email this with resume to jobs (at) crushhapp.com.Job Type: InternshipSalary: $12.00 /hourEducation:Bachelor's (Required)Job Location:New York, NY (Required)Language:English (Required)]
