|city|job_title|company_name|location|summary|salary|link|summary_full
26|New+York+NY|Data Scientist, Marketing|Squarespace|New York, NY 10014 (West Village area)|We are seeking multiple Data Scientists who demonstrate sharp intellectual curiosity, data fluency, and a collaborative work ethic....||https://www.indeed.com//rc/clk?jk=fcee9b6407287cc7&fccid=10c1f2532daaed15&vjs=3|"[Marketing Data Scientists formulate the analytical frameworks and provide the technical rigor to drive pivotal business decisions. In close partnership with Marketing team leads, you’ll identify the fundamental questions we need to ask and have ownership over the data-driven means of addressing them. This role requires long-term specialization in three domains: (1) advanced statistics, (2) execution of targeted marketing tactics, and (3) classical consumer research.

Depending on your area of focus, challenges you may tackle in a typical day include:


Measuring the response to emails announcing new products
Studying Google search behavior in the wake of our Super Bowl ads
Analyzing growth of awareness of Squarespace in London, Sydney, or Singapore - and comparing how awareness relates to trends in word-of-mouth about the company
Forecasting demand for customer service
Studying the overlap between audiences of different podcasts, and creating tactics for testing new podcasts for Squarespace ads
Analyzing the optimal wording in ad campaigns
Segmenting customers by product behavior
Modeling drivers of customer retention using survival analysis
Leading efforts to accurately define a customer’s location
Refining marketing attribution and media mix modeling tools

We are seeking multiple Data Scientists who demonstrate sharp intellectual curiosity, data fluency, and a collaborative work ethic. These roles report to an Analytics team lead in New York.

RESPONSIBILITIES


Empower data-driven decision-making across the org by defining analytical frameworks to guide key business decisions; develop and maintain dashboards to provide visibility into relevant metrics
Surface insights from terabytes of proprietary user, product, and marketing data; communicate compelling recommendations to key stakeholders
Formulate innovative hypotheses; design and implement rigorous methodologies for testing them
Utilize cutting-edge statistical/machine learning techniques to build models furthering the org’s understanding of and ability to predict consumer behavior
Continuously get better - seek out opportunities to further develop your analytical, engineering, statistical, etc. toolkit

QUALIFICATIONS


An MS in a relevant technical field or 2+ years of relevant analytical experience
Competency with both SQL and a scripting language (Python preferred); Strong competency with at least one of them
Experience with statistical and/or ML modeling techniques
Ability to communicate effectively with wide-range of audiences
Comfort working on open-ended problems with limited guidance
Strong data intuition and ability to think probabilistically
Ability to devise data-driven solutions to business problems

ABOUT SQUARESPACE

Squarespace makes beautiful products to help people with creative ideas succeed. By blending elegant design and sophisticated engineering, we empower millions of people — from individuals and local artists to entrepreneurs shaping the world’s most iconic businesses — to share their stories with the world. Squarespace’s team of more than 700 is headquartered in downtown New York City, with offices in Dublin and Portland. For more information, visit www.squarespace.com/about ( https://www.squarespace.com/about ).

PERKS

Health insurance with 100% premium covered
Flexible vacation & paid time off
Equity plan
401(k) plan with employer match
Free lunch and snacks
Dog-friendly workplace
And more ( https://squarespace.com/about/careers )

Today, more than a million people around the globe use Squarespace to share different perspectives and experiences with the world. Not only do we embrace and celebrate the diversity of our customer base, but we also strive for the same in our employees. At Squarespace, we are committed to equal employment opportunity regardless of race, color, ancestry, religion, sex, national origin, sexual orientation, age, citizenship, marital status, disability, gender, gender identity or expression, or veteran status. We are proud to be an equal opportunity workplace.]"
27|New+York+NY|Data Scientist, Data & Analytics|MLB Advanced Media|New York, NY 10011 (Chelsea area)|Data Scientist, Data & Analytics. MLBAM is looking for a Data Scientist to join its Data & Analytics team in our New York City office....||https://www.indeed.com//rc/clk?jk=d7aa826aa29d92db&fccid=42eb4b40b1c2ae00&vjs=3|"[Position: Data Scientist, Data & Analytics
Reports to: Director, Advanced Analytics at MLB Advanced Media

Overview

Who is likely to renew their season tickets? Or churn? Which fans are likely to upgrade to a package? Or buy again? How do we best communicate with fans and encourage them to attend another game?

MLBAM is looking for a Data Scientist to join its Data & Analytics team in our New York City office. The Data & Analytics team aggregates data from hundreds of online and offline sources and leverages it to provide insight, better serve fans, and drive growth for the league and its 30 Clubs.

In this crucial role, you will be responsible for manipulating and analyzing complex, high-volume, high-dimensionality data from a myriad of sources. You will help drive a deeper understanding of MLB's fans, develop and validate predictive models, partner with Data Engineering to deploy them at scale, and collaborate with the Growth team and Clubs to drive ticket sales, fan engagement and business impact. You will also have the opportunity to present and share insights with business leads at MLB and the 30 Clubs.

If you love Data, Baseball, and delivering work that makes an impact, you've come to the right place.

Core Responsibilities


Translate business challenges into data pipelines & model framework
Train, validate, and tune predictive models around fans’ behavior
Analyze, interpret & communicate the results of experiments
Deliver business value by translating complex data into meaningful insights
Effectively present and explain complex concepts to a non-technical audience

Qualifications

Required Qualifications


A strong foundation in probability, statistics, and algorithm development
Experience programmatically structuring and cleaning data, and not just analyzing highly cleaned data sets
You're a self-starter that's highly accountable and will take ownership of delivering your work
Strong understanding of building models, ability to validate and measure efficacy of models via various metrics, and the knowledge to know what metrics make sense for which situation
Comfort manipulating and analyzing complex, high-volume, high-dimensionality data from varying sources

Minimum Qualifications


2-4 years of relevant experience in Data Science
Programming skills that allow you to be self-sufficient in handling data (Python, SQL, Scala, Java)

Preferred Qualifications


Experience with large datasets and distributed computing (Hive/Hadoop, Spark)
Experience with statistical tools or packages: Python (strongly preferred; specifically with scipy, numpy, scikit-learn etc), R, SAS, SPSS, or Matlab
Experience with Amazon Web Services (or similar cloud services platform)]"
28|New+York+NY|Research Scientist, Google Brain (United States)|Google|New York, NY 10011 (Chelsea area)|From creating experiments and prototyping implementations to designing new learning algorithms, Research Scientists work on challenges in machine perception,...||https://www.indeed.com//rc/clk?jk=468fa45edb689997&fccid=a5b4499d9e91a5c6&vjs=3|"[Research Scientists at Google work closely with Software Engineers to discover, invent, and build at the largest scale. Ideas may come from internal projects as well as from collaborations with researchers at partner universities and technical institutes all over the world. From creating experiments and prototyping implementations to designing new learning algorithms, Research Scientists work on challenges in machine perception, data mining, machine learning, and natural language understanding. As a Google Research Scientist, you will continue to be an active contributor to the wider research community by collaborating with academic researchers and by publishing papers.


Researchers on the Google Brain team have the freedom to set their research agenda and to engage as much or as little as they wish with existing products, choosing between doing more basic, methodological research or more applied research as necessary to produce the most compelling results. Because many of the advances we develop today may take years to become useful, the team as a whole maintains a portfolio of projects across this spectrum. It is our philosophy that making substantive progress on hard applications can help drive and sharpen the research questions we study, and in turn scientific breakthroughs can spawn entirely new applications.


The Google Brain team’s research focuses on methods that can learn multiple layers of rich, non-linear feature extractors and can scale to large amounts of data. Much of our work is best understood as part of the deep learning subfield of machine learning, but we are interested in any methods capable of efficient and effective feature learning that get good results on challenging problems. We have resources and access to projects impossible to find elsewhere. Our broad and fundamental research goals allow us to collaborate closely with and–contribute uniquely to–many different product teams across the company.


Responsibilities
Participate in cutting edge research in machine intelligence and machine learning applications.
Develop solutions for real world, large scale problems.

Qualifications
Minimum qualifications:
PhD in Computer Science, related technical field or equivalent practical experience.
Experience in Natural Language Understanding, Computer Vision, Machine Learning, Algorithmic Foundations of Optimization, Data Mining or Machine Intelligence (Artificial Intelligence)
Programming experience in one or more of the following: C, C++, Python
Contributions to research communities and/or efforts, including publishing papers in machine learning venues (e.g: JMLR, ICLR, NIPS, ICML, ACL and CVPR)

Preferred qualifications:
Relevant work experience, including full time industry experience or as a researcher in a lab
Strong publication record
Ability to design and execute on research agenda.]"
29|New+York+NY|Software Engineer - Big Data/Python|KPMG|New York, NY 10261|Design, develop and maintain artificial intelligence-enabled managed services (APIs) with a team of Data Scientist, Software Engineers and Project Managers....||https://www.indeed.com//pagead/clk?mo=r&ad=-6NYlbfkN0CzN6uX84z9wq8HaOCWH9ZvJLeemKyVc3gCGVrPSg-ucKoPSUpfOYdwB0JQpoDjiKgxAB0GeP9CVUiIHlOkIUany_ONVqiaXiyFvFzl7b8GfhYXGIuhxd7r2p3_Xux6a_4BkFYqeHB69R1XofZqQiFXLyiCL5-0dITEnJr6HrLZrukebZXwHYDY2fh9Pyslv7fR6-zQG0rQHZd2qmT1khNbcXLLjYNUg0pm87QH9Zvft9b765BfhQOd7CSHqI0pN7ldPSeTPCiUvbm3t2HTx3sCG_SN2LAzowiuXnyJKLpBvxhdn_B785r1oZCb7AciQs4fXAnil7m0uIJPuPDK96-h83YTIEne9z1F-hdMl_guikTL_qJ9WxuiWSnYds4ZKRuPxUlxAsy1iUNUj9hWBUVMvbh7gOG18UY=&vjs=3&p=3&sk=&fvj=0|"[Known for being a great place to work and build a career, KPMG provides audit, tax and advisory services for organizations in today's most important industries. Our growth is driven by delivering real results for our clients. It's also enabled by our culture, which encourages individual development, embraces an inclusive environment, rewards innovative excellence and supports our communities. With qualities like those, it's no wonder we're consistently ranked among the best companies to work for by Fortune Magazine, Consulting Magazine, Working Mother Magazine, Diversity Inc. and others. If you're as passionate about your future as we are, join our team.
KPMG is currently seeking an Artificial Intelligence Software Engineer to join our Advanced Analytics Organization
Responsibilities:
Design, develop and maintain artificial intelligence-enabled managed services (APIs) with a team of Data Scientist, Software Engineers and Project Managers
Architect, implement and test data processing pipelines (e.g. Hadoop and Spark) and data mining / data science algorithms on a variety of hosted settings, such as Cloud (AWS, Azure, GCP) and KPMG's own clusters
Develop containers (Docker) to ensure that APIs and processing pipeline can be easily deployed across a variety of hardware and software architectures
Build continuous integration and automated deployment environments
Develop automated reporting for API and system health (process, memory, response time)
Translate advanced technical architectures into production systems and contribute to the continual maintenance and testing of processes, APIs and associated user interfaces
Qualifications:
A minimum of two years of direct experience or close working relationship with DevOps engineering and previous big data experience with multiple programming languages and technologies
Bachelor's degree from an accredited college or university in Computer Science, Computer Engineering, or a related field
Fluency in several programming languages such as Python, Scala, or Java, with the ability to pick up new languages and technologies quickly; Understanding of cloud and distributed systems principles, including load balancing, networks, scaling, in-memory vs. disk; Experience with large-scale, big data methods, such as MapReduce, Hadoop, Spark, Hive, Impala, or Storm
Ability to work efficiently under Unix/Linux environment with experience with source code management systems like GIT; Ability to work with international team needs, provide assistance, and resolve problems, using excellent problem-solving skills, verbal/written communication
Good understanding of object oriented design and design patterns; Familiarity with agile software development practices, testing strategies and solid unit testing skills; Experience with the following: cloud computing and virtualization, persistence technologies both relational and No-SQL and multi-layered distributed applications
Applicants must be currently authorized to work in the United States without the need for visa sponsorship now or in the future and the ability to travel up to eight percent at times
KPMG LLP (the U.S. member firm of KPMG International) offers a comprehensive compensation and benefits package. KPMG is an equal opportunity employer. All qualified applicants are considered for employment without regard to race, color, creed, religion, age, sex/gender, national origin, ancestry, citizenship status, marital status, sexual orientation, gender identity or expression, disability, physical or mental handicap unrelated to ability, pregnancy, veteran status, unfavorable discharge from military service, genetic information, personal appearance, family responsibility, matriculation or political affiliation, or other legally protected status. KPMG maintains a drug-free workplace. KPMG will consider for employment qualified applicants with criminal histories in a manner consistent with the requirements of applicable local, state or federal law (including San Francisco Ordinance number 131192). No phone calls or agencies please.]"
30|New+York+NY|Data Scientist - Fixed Income Real-Time Pricing|Bloomberg|New York, NY|Design models that are highly robust with an emphasis on data integrity and a rigorous, defendable scientific approach....||https://www.indeed.com//pagead/clk?mo=r&ad=-6NYlbfkN0Ab67y_gTDH9tSaT0HLOcX4Q3W4UsL2WfVRyJV-qqww-YJ_ltwPKUIOQtlXfcv8uV3hp3QxTJUukcwBoWVTwIelbgU4WyMwVJ75tZypZLGjqQKJ_HMp0-dsoFCjZPgrDBAWXnEvapg0e3jH38MJl7EGCVj8OYN6N1k-wNiuXiTM8sRRigx8hX9LgAU-o33vTbDRsVqqWqHrEnTLcZxDqgpF6xRC8AapgjvWqYIVtvFvbzkkq1Tq3xO5NM4i9YKSi29B0rc0SNSa3HcKMer0uAZzjz0UvF1T2s8YmWzyG8KbDi1syqu9P--BRCUxCLo_jMrbJcsXcV4MHh4_Kqz2zmuaBDFnEZbx2PPmtN6lbDnn_R_7GFyWVSkzQ4ShRibkO2gCxTvt-EmsVjKblLc-KT9m2YM0WhqcMt_H84lr8tWS1Jextu20o0aGU83zAyqdW80zmLNlNuoGg__ZgwpNIfXChb2asyZRvOtC9Hi3ed7-mN-BDNexlUU3ChguC2EQFuqe2jyncr-agbv6-8UiiEysnFULHLKO8S2MtmrspitW_EYub0z6pZJ1uKsjGKdGauZAeHlu_OCE5giihFs9ym5b3I0Ko-MLrml7UMNZpCVdA4bfiA2K03lG6QcQ4HvAR7ZGjHrYe-mdvRMPyCR9dtDwbxWwLyrZYfU-a15DsWEVOv7NPvMzse68cUg48LrGVZTX0DIGmZxr3khp9Bua6YLbEdSmo13HKK5Zug3AAUZb3g==&vjs=3&p=4&sk=&fvj=0|"[Job Requisition Number:64749

The Fixed Income Real-Time Pricing team provides intraday pricing on a wide variety of asset classes. Our product gives clients unprecedented transparency into the OTC markets. We develop and support several real-time pricing engines customized for different use cases.We are working on new pricing models for the European, Chinese, and various other fixed income markets.
The quality of the algorithms we develop must be highly defensible and transparent to those who use the data for trading. We apply various quantitative methods for data cleaning and price generation, and build the tools needed to validate and monitor online quality. Backtesting is a key part of our algorithm development.
Some of the biggest technical challenges we face are those of scale; we must produce pricing in real time, while taking in millions of data points per minute. We achieve low latency and high throughput via distributed computing that scales horizontally.
As a Data Scientist you will help lead our research efforts as well as develop production-quality systems to further expand our product. You will work closely with our highly-quantitative product side to design the models for these systems.
We will trust you to:
Contribute research and be hands-on in the development of the product
Partner with stakeholders to understand requirements and take projects fully through the research and software life cycle
Design models that are highly robust with an emphasis on data integrity and a rigorous, defendable scientific approach
What's in it for you:
You will use C++, Python, Jupyter notebook, Redis, Jenkins and Google test, as well as explore cutting-edge technologies like Kafka and Cassandra on the Bloomberg Cloud
You will tackle some of the biggest scalability challenges in producing real-time pricing while taking in millions of data points per minute
You’ll need to have:
3 or more years of industry experience in a quantitative finance role within the fixed income area
Advanced degree in Mathematics, Statistics, Physics, Engineering, Finance or related field. Strong understanding of object-oriented design and problem solving skills
Experience leading projects through the complete life cycle from research and development to testing and deployment
Solid understanding of financial concepts including Fixed Income, Credit, callable bonds, curves, and relative value
Deep understanding of statistics, probability, inverse problems, stochastic calculus, financial and econometric models, as well as estimation and calibration techniques
Hands-on experience with C/C++ and Python Quantitative Development.
Excellent communication and collaboration skills
Experience with handling large scale data sets
We’d love to see:
PhD
Experience with MATLAB, Mathematica or R]"
31|New+York+NY|Data Scientist|AbleTo, Inc.|New York, NY|Combines best-in-class patient engagement with behavior change treatment programs that allow health plans and plan sponsors to improve health outcomes, while...||https://www.indeed.com//pagead/clk?mo=r&ad=-6NYlbfkN0DDxuA8Y4K3JnPiGV4kjt8LJAX0ZelysMhEJeNM_3_rWb_L4BVNF4KpDHXkayWIYw5H919b29Wv9kQgd-mQGWEY-QQXRpTL5rlsZ7_n6AWh5RptzR11B6ZJnyJplt7VTSzq1CsFIpNQMw5tjNn7j1kiIQbD0cTLOL66goE0wMvx9CYo4dHZPv_1AIf90kk6QgZnCeJP_Q3Nn88kOxJWzux74iUr8VkdYDwdQvbgwo4iyXkG-3nhuQo6i1g5CkVpsahnEhL9NJDsmMMffxSaaOs5Xp1sqNrHau1xYxMsBX-1V9BET1bV8veXnGwWuUNOT9_8mYxz1_4MHOWS75c95lwn__ty8By-I7EHF-jZ27eoPkMcM1Ui8rf4HKMc3cz7GqNGAwl_g11_4cYog6nfwToD-VzfRryHI_Jopk3UY9eeHwDcRTp6PhfmMm8HFW69VpAR3pg9FP_b-N9EYmvCFz6pWUEmYPf8Y5BcsZOAqbPbSSmQ0O1d-zAkUUsPUcQj4u3geYfka3xY96tYlm45Nc8Il1hI6aAsKX1nyqCNxo-Bv4RCXHnVQB4jt7dYhSufjWKHwDpO1WUynHAwzv2twlPby5Rh4nDc1pr4niBjggZAqKQgu6DJMU_U8RJyumb9G9Sh__Ldkm-Rbw==&vjs=3&p=5&sk=&fvj=0|[Overview]
32|New+York+NY|Data Scientist|Shore Group Associates, LLC|New York, NY|We are looking for data scientists who are not only interested in plugging data into a model, but also understanding the data like the back of their hand....||https://www.indeed.com//pagead/clk?mo=r&ad=-6NYlbfkN0AmtW71uMJ-FMTnSgQAi6MO2hfu514W2To_ok1EkQDsLzCSnVx2dJJdWh_eVltX3NiKTJsOZ1PdrHmGwruy3Gwutw1Y3myrtnW-EAYSCQP1_EOIcyntJdxtj6FPF62TyGkihYDHIjTCVu_fBirizqhYP0ctiOBdbqTmgUAix3AxYNB2n9YZfAH6tWJ9n7i50GKkWh-wxtrbYahwmzunDEJeIJzcv6WUrVDyQ7FYaO1l5C9Rot-tPx2PkVFqSV8LqaVR0wvIWzzuKCGGN-HltVkeae-my0m9XYgkIIuSMTGprGqlDStAQvvnAzbogOTwHTvnCxLmeDYVionNN6jRfpYoLCtz0BZO6fd2_eAeMmUFT32HgGvBnlP74W39AloJqbMIvdND6XBCM96B2-RYEv016wnDAbaBfjyV_LoFKzC6j5aKtvXySowN&vjs=3&p=1&sk=&fvj=1|[Description -Our team is building machine learning tools to help determine predict information about donors to a given foundation. This includes the likelihood of donation, the size of the donation, when is best to reach out to a given possible donor, and how to reach out. We are looking for data scientists who are not only interested in plugging data into a model, but also understanding the data like the back of their hand.Requirements -Analyze requirements and formulate an appropriate technical solution that meets functional and non-functional requirements.Experience with large datasets in the 100's of GBFundamental/broad understanding of data mining and predictive analytics techniques2+ years of Data Science Experience and a deep knowledge of various modeling techniques.Python (Pandas, SKLearn, NumPy, Matplotlib), SQL, GitStrong communication skills - both verbal and written – is a must.Strong experience with predictive regression modelsStrong software engineering skillsJob Type: Full-timeExperience:Data Science: 3 years (Required)]
