|city|job_title|company_name|location|summary|salary|link|summary_full
13|New+York+NY|Data Scientist|Atlantic Media|New York, NY 10011 (Chelsea area)|The Data Scientist will:. Quartz seeks a data scientist to help us improve with data. You would be joining our analytics team, which consists of several...||https://www.indeed.com//rc/clk?jk=d64adcc91feaa30d&fccid=b2a2b698f491af18&vjs=3|"[Quartz seeks a data scientist to help us improve with data. This position will lead data collection and analysis for all of our products, helping the product and editorial teams make better-informed decisions and optimize their efforts to serve and grow Quartz’s audience.
We have a diverse array of products with rich usage data and interesting challenges: QZ.com, our flagship website; the Quartz Daily Brief and four other popular emails; apps for iOS and Android; Atlas, a user-generated charted platform; and more. These are created by a talented group of designers, engineers, and product managers with whom you would work every day. And you would do it all within a forward-thinking newsroom that puts its users first and foremost.
The Data Scientist will:
analyze key questions about our products and their users;
know the questions we should be asking of our data;
implement a variety of algorithms (e.g. supervised and unsupervised machine learning, Bayesian MCMC) to support important product decisions
develop models for data collection in our products;
proactively study our data for new insights
Yes, it’s a big job! And it’s a new role for us, though you won’t be on your own in working with data at Quartz. You would be joining our analytics team, which consists of several analysts, data engineers, and a product scientist. And we have robust tracking on most of our existing products, which means you’d have rich data with which to work on day one.
To be successful in this job, you will of course need experience as a data scientist, product analyst, or something similar. And we also expect you will bring technical skills to the role: proficiency with big data cloud solutions and open source analytic tools. Experience with Python (Pandas and Scikit-Learn) is preferred, though we don’t insist on a particular language. It’s important that you can analyze and visualize data on your own.
Previous experience in media isn’t crucial, but it could definitely help. Regardless, you should have a strong interest in Quartz’s work and the many ways in which digital journalism products are different from other kinds of products. Most importantly, you should be a voice for the value of data and importance of rigorous analysis in a newsroom environment.
This job reports to the director of analytics. Candidates who can work in our New York office are strongly preferred, since our entire product team is located there, but we’ll consider applications from other locations. Please include with your application a cover letter and, if at all possible, a sample of your work in data science (github repo, a report, or other indication of what you can do).
Atlantic Media Values:
Across Atlantic Media, generally, the firm looks for two “pillar gifts” in its candidates. In all of us, these are more aspirational than actual, but they are central in our intentions.
Force of Ideas: At the center of Atlantic Media work are the ideas within our writing. We believe that ideas – to the good and not – have consequence. Our highest work is bringing rigor, insight, intellectual honesty, to that ultimate purpose of separating the bad from the good, giving voice, argument, and flight to the latter.
Spirit of Generosity: Atlantic Media seeks in its ranks a spirit of generosity – a natural disposition in each colleague toward service and selfless conduct. Atlantic Media writing should be cut from the same cloth – critical on the merits but informed by charity and forbearance in measuring motive and personal character.
Atlantic Media is an EOE of Minorities/Women/Vets/Disability.]"
14|New+York+NY|Data Scientist - Jr. / Mid Level|Techwave Consulting Inc.|New York, NY 10022 (Midtown area)|Create data table transformations, perform data validation. Analyze large data sets. Manage full life cycle projects with multiple stakeholders on an embedded...||https://www.indeed.com//rc/clk?jk=cad8c321416513f8&fccid=b4e04bf6950ab9ef&vjs=3|"[Data Scientist's (DS’s) create answers to client-driven business problems involving massive data sets (>10s of billions of rows) by designing high-performance analyses, databases, queries, applications, and workflow processes for Enterprise-level customers.
The DS is the technical face of the company who understands our customers data challenges and solves analytical problems whose solutions have substantial business impact.
Responsibilities:
Manage full life cycle projects with multiple stakeholders on an embedded client basis
Analyze large data sets
Design and implement operational and analytical reporting tools
Create data table transformations, perform data validation
Create clear, concise memos, summaries, design documentation, and presentations
Be the customer advocate and liaison to internal Techwave data team
Requirements:
STEM or other analytical degree
Experience solving unstructured problems whether business or academic
1-5 years of experience working with large amounts of data
Experience managing a project with multiple participants
Ability to communicate clearly with a strong, crisp message
Understanding of database structure, design, query languages (e.g. SQL)
Ability to build queries, reports, analyses, apps
Scripting programming languages (e.g. JavaScript, Perl, Python) to build interactive web applications
Ability to turn business needs into technical solutions
Training on our proprietary data analysis tools will be provided]"
15|New+York+NY|Data Scientist - Fixed Income Real-Time Pricing|Bloomberg|New York, NY|Design models that are highly robust with an emphasis on data integrity and a rigorous, defendable scientific approach....||https://www.indeed.com//pagead/clk?mo=r&ad=-6NYlbfkN0Ab67y_gTDH9tSaT0HLOcX4Q3W4UsL2WfVRyJV-qqww-YJ_ltwPKUIOQtlXfcv8uV3hp3QxTJUukcwBoWVTwIelbgU4WyMwVJ75tZypZLGjqQKJ_HMp0-dsoFCjZPgrDBAWXnEvapg0e8kYPmCPWRLjfnQttvgNuxRSx0sRfdTytAqmqEo-fMA3d-OavVcNz9t7maNjFFDmpRtqLM87EjJKB34obkwaKJY3SDPelBzFv-u6gRBU_jd73yjIqQzo2igbaS6RDiKJOyFUXXgU1eKEIFOImhKu00A4iDYqvIFw4R4YjKAE1RnELaKd_GoAAmQtZuMGWben_gpVdJJywb3WazRWWb1conaHkR8nUANhpEyt3cWozIMPWHpLtHcxvL9eCpsv7vQa2VlxmntFTa7U7tS5u_DK6LTmsBJwmU5xqNvT5aWriDT4EA-Nhu0LI5LgXszXUrIlEvJtMMurAT9X418plkIkBLMGIDsCy7AbZJiShxIQ0l2VWyBZjQTcMFqYXnbuHNRN-DkeODXPcI1ZTIep3gXk9_LqqIeNepkRNnrhNqDsxzyyn_SAyw16P9McCefpx5IhL4Y7bFUhXA42EqQpcbZZsq9y-2BvZ_eT8xSL8_fs3y0SZJVrvkM7BHXIN2HfFoCc6wrC12CWti6fdBwLpl-QTlYtjl_Nh48T9OaR6iCenlXyfTLjk6OWRndkVzWNjCM4ELCIp8b4Hl4hGlVJ2Lk9dfxB3LdVE4JeVw==&vjs=3&p=5&sk=&fvj=0|"[Job Requisition Number:64749

The Fixed Income Real-Time Pricing team provides intraday pricing on a wide variety of asset classes. Our product gives clients unprecedented transparency into the OTC markets. We develop and support several real-time pricing engines customized for different use cases.We are working on new pricing models for the European, Chinese, and various other fixed income markets.
The quality of the algorithms we develop must be highly defensible and transparent to those who use the data for trading. We apply various quantitative methods for data cleaning and price generation, and build the tools needed to validate and monitor online quality. Backtesting is a key part of our algorithm development.
Some of the biggest technical challenges we face are those of scale; we must produce pricing in real time, while taking in millions of data points per minute. We achieve low latency and high throughput via distributed computing that scales horizontally.
As a Data Scientist you will help lead our research efforts as well as develop production-quality systems to further expand our product. You will work closely with our highly-quantitative product side to design the models for these systems.
We will trust you to:
Contribute research and be hands-on in the development of the product
Partner with stakeholders to understand requirements and take projects fully through the research and software life cycle
Design models that are highly robust with an emphasis on data integrity and a rigorous, defendable scientific approach
What's in it for you:
You will use C++, Python, Jupyter notebook, Redis, Jenkins and Google test, as well as explore cutting-edge technologies like Kafka and Cassandra on the Bloomberg Cloud
You will tackle some of the biggest scalability challenges in producing real-time pricing while taking in millions of data points per minute
You’ll need to have:
3 or more years of industry experience in a quantitative finance role within the fixed income area
Advanced degree in Mathematics, Statistics, Physics, Engineering, Finance or related field. Strong understanding of object-oriented design and problem solving skills
Experience leading projects through the complete life cycle from research and development to testing and deployment
Solid understanding of financial concepts including Fixed Income, Credit, callable bonds, curves, and relative value
Deep understanding of statistics, probability, inverse problems, stochastic calculus, financial and econometric models, as well as estimation and calibration techniques
Hands-on experience with C/C++ and Python Quantitative Development.
Excellent communication and collaboration skills
Experience with handling large scale data sets
We’d love to see:
PhD
Experience with MATLAB, Mathematica or R]"
16|New+York+NY|Data Scientist|Shore Group Associates, LLC|New York, NY|We are looking for data scientists who are not only interested in plugging data into a model, but also understanding the data like the back of their hand....||https://www.indeed.com//pagead/clk?mo=r&ad=-6NYlbfkN0AmtW71uMJ-FMTnSgQAi6MO2hfu514W2To_ok1EkQDsLzCSnVx2dJJdWh_eVltX3NiKTJsOZ1PdrHmGwruy3Gwutw1Y3myrtnW-EAYSCQP1_EOIcyntJdxtj6FPF62TyGkihYDHIjTCVu_fBirizqhYP0ctiOBdbqR7wWjz5VUU9Pxex5v9aPz7xUvToAYM8A_4AIUQYxD9IrAXRXHcuWfqdN0h8UR8ODSovrzOfOGvzhi6eSxwQ_LxQTpFiPtYLQAv8HOD-EZylz9rI-Vaxa_rkoQmhWoA_VMnJ1LtwdUN2YK2OBh8Hy3MLLSiwLmqKqIpx1EhxEASx4TU_YZuvt4Lufpq6ZgA7V8mXZOqN1uN5zTigfzk7BbV4c47KhJebe0gTJ7SF6pFU7pFqAhYwzcWxk853W_b33OXlOYRw8N408_68W2t7v-8&vjs=3&p=6&sk=&fvj=1|[Description -Our team is building machine learning tools to help determine predict information about donors to a given foundation. This includes the likelihood of donation, the size of the donation, when is best to reach out to a given possible donor, and how to reach out. We are looking for data scientists who are not only interested in plugging data into a model, but also understanding the data like the back of their hand.Requirements -Analyze requirements and formulate an appropriate technical solution that meets functional and non-functional requirements.Experience with large datasets in the 100's of GBFundamental/broad understanding of data mining and predictive analytics techniques2+ years of Data Science Experience and a deep knowledge of various modeling techniques.Python (Pandas, SKLearn, NumPy, Matplotlib), SQL, GitStrong communication skills - both verbal and written – is a must.Strong experience with predictive regression modelsStrong software engineering skillsJob Type: Full-timeExperience:Data Science: 3 years (Required)]
17|New+York+NY|Data Scientist|Shore Group Associates, LLC|New York, NY|We are looking for data scientists who are not only interested in plugging data into a model, but also understanding the data like the back of their hand....||https://www.indeed.com//pagead/clk?mo=r&ad=-6NYlbfkN0AmtW71uMJ-FMTnSgQAi6MO2hfu514W2To_ok1EkQDsLzCSnVx2dJJdWh_eVltX3NiKTJsOZ1PdrHmGwruy3Gwutw1Y3myrtnW-EAYSCQP1_EOIcyntJdxtj6FPF62TyGkihYDHIjTCVu_fBirizqhYP0ctiOBdbqTr8Q_AHbZSHFPozafl8V_VUZ31An4Pr8ra097iG9jGqReo_hIDcHRMfGdzUaRwfTxNmP2BHIuxxACqM9InyhQxx2JmVW0K1iXQ8Z6chZKN0o6Lc-50FaNaiJu5jqSXWBTEA1lwFNKsSwgBtrwoC-mAhl4q7-o4QGNvG10z7WgSXgtgjAUvqIllg0Y0_3qqlg7Ltsu_Pc3LNV3JX1RKNVvaTdk3CO84C09qWM0F1eAkq8SRp0pzEMK5uYDcMn4wM1wOdAGxtr6Y7UOo_ktjdGBh&vjs=3&p=1&sk=&fvj=1|[Description -Our team is building machine learning tools to help determine predict information about donors to a given foundation. This includes the likelihood of donation, the size of the donation, when is best to reach out to a given possible donor, and how to reach out. We are looking for data scientists who are not only interested in plugging data into a model, but also understanding the data like the back of their hand.Requirements -Analyze requirements and formulate an appropriate technical solution that meets functional and non-functional requirements.Experience with large datasets in the 100's of GBFundamental/broad understanding of data mining and predictive analytics techniques2+ years of Data Science Experience and a deep knowledge of various modeling techniques.Python (Pandas, SKLearn, NumPy, Matplotlib), SQL, GitStrong communication skills - both verbal and written – is a must.Strong experience with predictive regression modelsStrong software engineering skillsJob Type: Full-timeExperience:Data Science: 3 years (Required)]
18|New+York+NY|Senior Associate, Data Scientist/Statistics - Financial Services|KPMG|New York, NY 10261|Machine learning, data visualization, statistical modeling, data mining, or information retrieval. Experience with command-line scripting, data structures and...||https://www.indeed.com//pagead/clk?mo=r&ad=-6NYlbfkN0CzN6uX84z9wq8HaOCWH9ZvJLeemKyVc3gCGVrPSg-ucKoPSUpfOYdwB0JQpoDjiKgxAB0GeP9CVesAraHbDNvnYpr5L6zfXvLrLgW5vOgAi-TsG-ObKUp-9-ahAlJJpzgSROtspAS3FPbpYn4cw8t33wEqnbmBfbFnF4pGjPEQBjq1avHSFf6ma_KknTWCFMPP5BXUPxEo3dyXIOoSK6shsJy-Knge2OxDOlAp7K3BGns5w30hIpb__5jAg1BCe6U-sxjvPDhvdTm8bl4Er2-fe__fe2TiJZgXdltMtt0mD5BL0RMpobdPXhr2mHMvXlBR6r3Loo2U65-ABXhYAYlDNA08AyU3qNcsIprAm78hUHSvwY9MzUMpYcxKIG96AY-LPP9qtZawmNHutrhDMIASJCebt-pV6f4=&vjs=3&p=2&sk=&fvj=0|"[Known for being a great place to work and build a career, KPMG provides audit, tax and advisory services for organizations in today’s most important industries. Our growth is driven by delivering real results for our clients. It’s also enabled by our culture, which encourages individual development, embraces an inclusive environment, rewards innovative excellence and supports our communities. With qualities like those, it’s no wonder we’re consistently ranked among the best companies to work for by Fortune Magazine, Consulting Magazine, Working Mother Magazine, Diversity Inc. and others. If you’re as passionate about your future as we are, join our team.
KPMG is currently seeking a Senior Associates, to join our Advanced Data Analytics Organization within the Financial Services Industry. Applicants must be currently authorized to work in the United States without the need for visa sponsorship now or in the future
Responsibilities:
Analyze and model structured data using advanced statistical methods and implement algorithms and software needed to perform analyses
Build recommendation engines, spam classifiers, sentiment analyzers and classifiers for unstructured and semi-structured data
Cluster large amount of user generated content and process data in large-scale environments using Amazon EC2, Storm, Hadoop and Spark
Perform machine learning, natural language, and statistical analysis methods, such as classification, collaborative filtering, association rules, sentiment analysis, topic modeling, time-series analysis, regression, statistical inference, and validation methods
Participate in client engagements focused on big data and advanced business analytics, in diverse domains such as product development, marketing research, public policy, optimization, and risk management; communicate results and educate others through reports and presentations
Perform explanatory data analyses, generate and test working hypotheses, prepare and analyze historical data and identify patterns
Qualifications:
A minimum of three years of professional experience working as a Data Scientist
Masters degree or PhD from an accredited college/university in Computer Science, Statistics, Mathematics, Engineering, Bioinformatics, Physics, Operations Research, or related fields, with a strong mathematical background and ability to understand algorithms and methods from a mathematical viewpoint and an intuitive viewpoint
Experience with command-line scripting, data structures and algorithms and ability to work in a Linux environment, processing large amounts of data in a cloud environment
Strong knowledge in at least one of the following fields: machine learning, data visualization, statistical modeling, data mining, or information retrieval
Strong data extraction and processing, using MapReduce, Pig, and/or Hive preferred
Ability to travel up to eighty percent of the time
KPMG LLP (the U.S. member firm of KPMG International) offers a comprehensive compensation and benefits package. KPMG is an equal opportunity employer. All qualified applicants are considered for employment without regard to race, color, creed, religion, age, sex/gender, national origin, ancestry, citizenship status, marital status, sexual orientation, gender identity or expression, disability, physical or mental handicap unrelated to ability, pregnancy, veteran status, unfavorable discharge from military service, genetic information, personal appearance, family responsibility, matriculation or political affiliation, or other legally protected status. KPMG maintains a drug-free workplace. KPMG will consider for employment qualified applicants with criminal histories in a manner consistent with the requirements of applicable local, state or federal law (including San Francisco Ordinance number 131192). No phone calls or agencies please.]"
19|New+York+NY|Data Scientist, Google BrandLab and Unskippable Experiments|Google|New York, NY 10011 (Chelsea area)|Shape and deliver deep data insights that advances the recommendations and broader thought leadership to our clients to accelerate their online video marketing...||https://www.indeed.com//rc/clk?jk=5c35775ed483e452&fccid=a5b4499d9e91a5c6&vjs=3|"[Businesses that partner with Google come in all shapes, sizes and market caps, and no one Google advertising solution works for all. Your knowledge of online media combined with your communication skills and analytical abilities shapes how new and existing business grow. Using your influencing and relationship-building skills, you provide Google-caliber client service, research and market analysis. You anticipate how decisions are made, persistently explore and uncover the business needs of Google's key clients and understand how our range of product offerings can grow their business. Working with them, you set the vision and the strategy for how their advertising can reach thousands of users.


Google BrandLab provides Google’s top partners with an accelerator program that delivers data-driven solutions to solve their critical brand campaign challenges and advance their digital video strategies. The Unskippable Experiments team provides breakthrough creative effectiveness, using a collaborative experimentation approach that uncovers innovative creative approaches for video ads grounded in data.


You will provide the data and analytical rigor for both teams, in their shared mission to drive excellence in digital video strategy and execution for our top advertising partners. The team’s programs and experiments are focussed on developing hypotheses, custom creative and/or media recommendations and testing these via rapid and innovative tests.


Our Global Clients & Agency Solutions team helps serve some of the world's largest brands. Our dedicated teams of marketing and advertising specialists use their unique skill sets to help shape how companies grow their businesses in the digital age. We aspire to advise our clients on all aspects of their online business strategy. Using Google's broad range of products, we help our clients connect instantly and seamlessly with their audiences.


Responsibilities
Shape and deliver deep data insights that advances the recommendations and broader thought leadership to our clients to accelerate their online video marketing strategies.
Manipulate and analyze multiple datasets to test and identify the impact of various creative and media factors (i.e. creative comparisons, multi-asset x multi-cell, media sequencing). Leverage Google’s data, research and measurement solutions, and 3rd party data and analysis techniques to develop innovative methodologies to uncover new outcomes.
Learn about new data sets, and shaping the data to be accessible for the team (i.e. dashboards) and present internally/externally. Comfortable navigating other global/regional teams who are working on creative/media effectiveness to unlock new opportunities and share learnings.
Develop an in-depth understanding of the BrandLab Acceleration Program (BLAP) and Unskippable Experiments experiences. This will give you the opportunity to collaborate with the team in the prep, planning and execution of each of the team’s service offer.

Qualifications
Minimum qualifications:
Bachelor’s degree in Computer Science, Engineering, Information Science, Data Science or a similar field of study or equivalent practical experience.
Experience with factors that are driving the evolution of the digital landscape (Mobile, Programmatic, Measurement etc) for brand marketers.
Experience analyzing advertising and media data, extracting transformative insights to move an advertisers business and building scalable solutions through dashboards and automating analyses.
Experience with programming languages (Java, Python, JavaScript), SQL and data tools ecosystem, Google Cloud Platform (including App Engine, Compute Engine, BigQuery).

Preferred qualifications:
6 years of total work experience, with 4 years in a data-centric leadership role managing complex data strategy and cross-functional projects with hands-on experience with digital data.
Deep experience in testing creative and/or media and campaign strategies for advertising clients.
Experience presenting to senior-level clients and know how to capture their attention and expand their thinking.
Proven analytic capabilities around business and brand campaign challenges and opportunities, with the ability to make strategic recommendations to strengthen their digital video strategies.
Proven success in high productivity environments and an ability to work efficiently and manage multiple projects and stakeholders at the same time. Proven ability to work cooperatively and proactively with teams inside and outside Google.
Ability to speak marketer’s language and present data in a compelling way, and make complex data sets/concepts simple to understand.]"
