|city|job_title|company_name|location|summary|salary|link|summary_full
1|New+York+NY|Data Scientist|AbleTo, Inc.|New York, NY|Combines best-in-class patient engagement with behavior change treatment programs that allow health plans and plan sponsors to improve health outcomes, while...||https://www.indeed.com//pagead/clk?mo=r&ad=-6NYlbfkN0DDxuA8Y4K3JnPiGV4kjt8LJAX0ZelysMhEJeNM_3_rWb_L4BVNF4KpDHXkayWIYw5H919b29Wv9kQgd-mQGWEY-QQXRpTL5rlsZ7_n6AWh5RptzR11B6ZJnyJplt7VTSzq1CsFIpNQMw5tjNn7j1ki4fR5ffKzwFIyfhhm83EX2gaJ5-jnoeTNEFxwmAYIYVZDcZM4p7WW-dfE3lwCrW8Gnq3dAcKn-ciKMDMRDQ5WO5zbVEWwMrUflRMcNmh6Utuo74KwHXqnr_P_U9yjlTDoZwJ_4YMnBv-MIiCeX_Gint5y_DzYgw-3n6TtemclNY-E8TDaictGI3jQ_TvEHCG-5C90b8m7DuZwVh-50dutDuvwn8lwl6tps2t92dd0jTOHLak7K_BDf9FpB1ly69ffQa-1p8wYLRRI6jQRWp-MMTwCJtLbslXs0mXe-e73D1iP3_dhoL8SuAh-cCVwZYhMiP59fGzi6SvWnUxLaVarWpAYJe-QuAYPgpffQLxhCC8RLPdSMUTLe0qEYmIstFZI1jhhjcxBEZ_GGfpGyf7rFnzWx0VbAnWcVlG8Z3nMUGkx3caqFdawmHKKwYsJkum7OxKN4UG6XquJeoxcLVoD_r2IkEwvp8X7iLrWKA6n3RSPXnJSvW3e_Q==&vjs=3&p=1&sk=&fvj=0|"[Overview
AbleTo Inc. combines best-in-class patient engagement with behavior change treatment programs that allow health plans and plan sponsors to improve health outcomes, while lowering overall spending, for high-cost medical populations. Benefitting groups include heart patients and diabetics, as well as those suffering from depression/anxiety and chronic pain. All sixteen of our programs utilize best practice protocols and are delivered nationally by teams of licensed therapists and behavioral coaches. Program participants experience improved health, better recovery and in the case of heart patients, fewer hospitalizations.
Responsibilities
Data & Analytics Team

The Data & Analytics team plays a key role at AbleTo. Data is part of nearly everything that we do. The Data & Analytics team is responsible for storing data, making it useful and actionable for business managers, and using it to validate the impact of our programs and inform organizational improvements.
As a Data Scientist at AbleTo, you will work in a uniquely cross-functional capacity, helping teams across the organization apply analytical rigor to their decision-making:

With our Research team, you will build claims-based predictive models to identify patients who can benefit from our programs and drive value for our clients
With our Engagement team, you will help optimize a coordinated, multi-channel patient outreach process
With our Account Management team, you will develop reporting that demonstrates how AbleTo is helping clients manage their patient populations
With our Clinical team, you will ensure that our therapist network is operating efficiently and is structured appropriately to meet demand
With our Product team, you will use data-driven insights to design new product features for our platform
With our Engineering team, you will help manage our data stack and ETL processes that feed our data warehouse

Members of the Data & Analytics team are:

Both technically and strategically savvy
Able to sift through large amounts of data and extract insights
Able to present recommendations to non-technical audiences
Highly organized and able to manage time across multiple competing priorities
Focused on building flexible, durable, and well-designed solutions
Focused on preserving quality control
Willing to experiment with new tools / techniques

Data & Analytics team culture:
Collaboration: You will work with teams across the organization to both design and build data-driven solutions
Innovation: Our team prioritizes innovation over precedent. We’re always looking for new, more efficient ways of doing things
High-Impact Focus: Our team receives a lot of requests for new analyses, processes, reports, etc. It is our job to prioritize these requests with our stakeholders and invest time in projects with the highest potential value-add for the organization. You will be actively involved in making these decisions
Qualifications
Technical Skills

Strong proficiency in SQL and R/Python
Experience working on cloud-based platforms like AWS/GCS
Comfortable with variety of analytical techniques:
Predictive modeling (e.g. regularized regressions, decision trees / random forests, association rules mining)
Optimization (e.g. linear programming)
Exploratory analysis (e.g. clustering, PCA)
Some familiarity with BI tools such as Looker or Tableau

Education / Experience
BA in Operations Research, Computer Science, or other related discipline
2-3 years work experience is strongly preferred

Additionally to the technical requirements for this specific position, AbleTo seeks candidates that will demonstrate:

Personal ownership of assignments and responsibilities
Resilience and grit to ensure task completion even in the face of adversity
Discipline and organization to handle multiple tasks simultaneously
Great team playing skills
High levels of energy and positive ambition
A healthy balance of curiosity, humility and assertiveness
Excellent written and verbal communication skills
Professional attitude and demeanor
AbleTo is committed to equal employment opportunities (EEO) and employs qualified persons without regard to race, color, religion, national origin, sex, age, handicap, or any other classification protected by federal, state, or local laws.
AbleTo is an E-Verify Company]"
2|New+York+NY|Senior Associate, Data Scientist/Statistics - Financial Services|KPMG|New York, NY 10261|Machine learning, data visualization, statistical modeling, data mining, or information retrieval. Experience with command-line scripting, data structures and...||https://www.indeed.com//pagead/clk?mo=r&ad=-6NYlbfkN0CzN6uX84z9wq8HaOCWH9ZvJLeemKyVc3gCGVrPSg-ucKoPSUpfOYdwB0JQpoDjiKgxAB0GeP9CVesAraHbDNvnYpr5L6zfXvLrLgW5vOgAi-TsG-ObKUp-9-ahAlJJpzgSROtspAS3FCjmMkY6fjA--VhikHniE9cG_ekH4GyXNJrOXMhH7EBzalqhipMc133y92vRGoH4psUJPpAhabC-3FVBVrC5c39zL3wsRMdvjvg6CmylFyXgUOhPhNZCeGU7ZyOSkwGzUllFE6r95qohKEZQ3NqSjotMstRTP4wCT2C6CutgA8VMiQyxDaSakIN0mLHeaJFdEPecCRu_nhoK1Yn4LtM06sADRlR4kJSFzEotsJKkbRxgVh-ij56j-VomUTH44J1t-K0m1TVDyHy8QhQwxkfDZ6k=&vjs=3&p=2&sk=&fvj=0|"[Known for being a great place to work and build a career, KPMG provides audit, tax and advisory services for organizations in today’s most important industries. Our growth is driven by delivering real results for our clients. It’s also enabled by our culture, which encourages individual development, embraces an inclusive environment, rewards innovative excellence and supports our communities. With qualities like those, it’s no wonder we’re consistently ranked among the best companies to work for by Fortune Magazine, Consulting Magazine, Working Mother Magazine, Diversity Inc. and others. If you’re as passionate about your future as we are, join our team.
KPMG is currently seeking a Senior Associates, to join our Advanced Data Analytics Organization within the Financial Services Industry. Applicants must be currently authorized to work in the United States without the need for visa sponsorship now or in the future
Responsibilities:
Analyze and model structured data using advanced statistical methods and implement algorithms and software needed to perform analyses
Build recommendation engines, spam classifiers, sentiment analyzers and classifiers for unstructured and semi-structured data
Cluster large amount of user generated content and process data in large-scale environments using Amazon EC2, Storm, Hadoop and Spark
Perform machine learning, natural language, and statistical analysis methods, such as classification, collaborative filtering, association rules, sentiment analysis, topic modeling, time-series analysis, regression, statistical inference, and validation methods
Participate in client engagements focused on big data and advanced business analytics, in diverse domains such as product development, marketing research, public policy, optimization, and risk management; communicate results and educate others through reports and presentations
Perform explanatory data analyses, generate and test working hypotheses, prepare and analyze historical data and identify patterns
Qualifications:
A minimum of three years of professional experience working as a Data Scientist
Masters degree or PhD from an accredited college/university in Computer Science, Statistics, Mathematics, Engineering, Bioinformatics, Physics, Operations Research, or related fields, with a strong mathematical background and ability to understand algorithms and methods from a mathematical viewpoint and an intuitive viewpoint
Experience with command-line scripting, data structures and algorithms and ability to work in a Linux environment, processing large amounts of data in a cloud environment
Strong knowledge in at least one of the following fields: machine learning, data visualization, statistical modeling, data mining, or information retrieval
Strong data extraction and processing, using MapReduce, Pig, and/or Hive preferred
Ability to travel up to eighty percent of the time
KPMG LLP (the U.S. member firm of KPMG International) offers a comprehensive compensation and benefits package. KPMG is an equal opportunity employer. All qualified applicants are considered for employment without regard to race, color, creed, religion, age, sex/gender, national origin, ancestry, citizenship status, marital status, sexual orientation, gender identity or expression, disability, physical or mental handicap unrelated to ability, pregnancy, veteran status, unfavorable discharge from military service, genetic information, personal appearance, family responsibility, matriculation or political affiliation, or other legally protected status. KPMG maintains a drug-free workplace. KPMG will consider for employment qualified applicants with criminal histories in a manner consistent with the requirements of applicable local, state or federal law (including San Francisco Ordinance number 131192). No phone calls or agencies please.]"
3|New+York+NY|Software Engineer - Big Data/Python|KPMG|New York, NY 10261|Design, develop and maintain artificial intelligence-enabled managed services (APIs) with a team of Data Scientist, Software Engineers and Project Managers....||https://www.indeed.com//pagead/clk?mo=r&ad=-6NYlbfkN0CzN6uX84z9wq8HaOCWH9ZvJLeemKyVc3gCGVrPSg-ucKoPSUpfOYdwB0JQpoDjiKgxAB0GeP9CVUiIHlOkIUany_ONVqiaXiyFvFzl7b8GfhYXGIuhxd7r2p3_Xux6a_4BkFYqeHB69fm70pLXFX--Esgk-SNXXzz0nzp5uun8UViTCJ3BL260v8a1cRoANHIe_gqGNzDgjloOtYzDD9tyL9lRIoxHtZdu4tUlB7LnSblmy2HisGuTICbodTNiRjSwktsPcj8fBb1xM3y2_AlfGJnMfkhEnTo3h0hOPbwyVy8aFjaiBcbnEGtUYF0dlxy6rrbM3-nt1efs1uVugMy5Btq_E00XjK96N43AaCGx9m2nFEHZySvB0ffje_66CBcQ5iv-l-qpfpavTqRRPzMecwYs645JgAg=&vjs=3&p=3&sk=&fvj=0|"[Known for being a great place to work and build a career, KPMG provides audit, tax and advisory services for organizations in today's most important industries. Our growth is driven by delivering real results for our clients. It's also enabled by our culture, which encourages individual development, embraces an inclusive environment, rewards innovative excellence and supports our communities. With qualities like those, it's no wonder we're consistently ranked among the best companies to work for by Fortune Magazine, Consulting Magazine, Working Mother Magazine, Diversity Inc. and others. If you're as passionate about your future as we are, join our team.
KPMG is currently seeking an Artificial Intelligence Software Engineer to join our Advanced Analytics Organization
Responsibilities:
Design, develop and maintain artificial intelligence-enabled managed services (APIs) with a team of Data Scientist, Software Engineers and Project Managers
Architect, implement and test data processing pipelines (e.g. Hadoop and Spark) and data mining / data science algorithms on a variety of hosted settings, such as Cloud (AWS, Azure, GCP) and KPMG's own clusters
Develop containers (Docker) to ensure that APIs and processing pipeline can be easily deployed across a variety of hardware and software architectures
Build continuous integration and automated deployment environments
Develop automated reporting for API and system health (process, memory, response time)
Translate advanced technical architectures into production systems and contribute to the continual maintenance and testing of processes, APIs and associated user interfaces
Qualifications:
A minimum of two years of direct experience or close working relationship with DevOps engineering and previous big data experience with multiple programming languages and technologies
Bachelor's degree from an accredited college or university in Computer Science, Computer Engineering, or a related field
Fluency in several programming languages such as Python, Scala, or Java, with the ability to pick up new languages and technologies quickly; Understanding of cloud and distributed systems principles, including load balancing, networks, scaling, in-memory vs. disk; Experience with large-scale, big data methods, such as MapReduce, Hadoop, Spark, Hive, Impala, or Storm
Ability to work efficiently under Unix/Linux environment with experience with source code management systems like GIT; Ability to work with international team needs, provide assistance, and resolve problems, using excellent problem-solving skills, verbal/written communication
Good understanding of object oriented design and design patterns; Familiarity with agile software development practices, testing strategies and solid unit testing skills; Experience with the following: cloud computing and virtualization, persistence technologies both relational and No-SQL and multi-layered distributed applications
Applicants must be currently authorized to work in the United States without the need for visa sponsorship now or in the future and the ability to travel up to eight percent at times
KPMG LLP (the U.S. member firm of KPMG International) offers a comprehensive compensation and benefits package. KPMG is an equal opportunity employer. All qualified applicants are considered for employment without regard to race, color, creed, religion, age, sex/gender, national origin, ancestry, citizenship status, marital status, sexual orientation, gender identity or expression, disability, physical or mental handicap unrelated to ability, pregnancy, veteran status, unfavorable discharge from military service, genetic information, personal appearance, family responsibility, matriculation or political affiliation, or other legally protected status. KPMG maintains a drug-free workplace. KPMG will consider for employment qualified applicants with criminal histories in a manner consistent with the requirements of applicable local, state or federal law (including San Francisco Ordinance number 131192). No phone calls or agencies please.]"
4|New+York+NY|Research Software Engineer, Google Brain|Google|New York, NY 10011|You manage individual project priorities, deadlines, and deliverables, adapting to changes and setbacks in order to manage pressures, demonstrating and applying...||https://www.indeed.com//pagead/clk?mo=r&ad=-6NYlbfkN0B6LV1r5rpdxHXQFKF2tEJssbaTH9yAUMN6EqMbe2y0QYBox13rzug83haoOGZKjDODci_i5055gXb6PnsRvgM0jvb_GPeQHp2M-v8qUj9UrD5K_cLAkpFVM5kfidMTjIAGCLAqlvz2RBBR2hjIY4WHPbMpFd6oiQHkbM1Tkg5tKfYDT6knHi8OUm4Uv7XIH0ouwZN9hZ3hUtNT2vEHWHKgnB5s5vWW35-YxP8jnd74CAIEK9BCVhgbtMu0AiiszZfhwymaOpNpK6YZ-yLz6h-cQ4IGi7V0bF5_bVLaj_PClZnabx404pNZ7vDsA9LZLA7_QAC8AZJ0xOMT6Rx1cSX7j5QL6WFdVEIHr2Qer4cPbx5LoQRiZ78Am3TsG-c8zdWcxmzlRSlS32BLAFaO3RQ1pJ41RoK51ixWm_cJ_RPUCaAUSHunHFmZxPSWNEJdTMIOOjM1GAiCHMbMqMaTryj4UMQiWpmx-GjKlOyO-3cfm-TxOsZ-YiFQ2wbIZ_qm3QYbE0rIoHqyM8PvXPEjKYVCaJwLglwHq3pZ_2oBY4m8zLI3KWzD9SfACNgNdEjdA0urmHKfuhs4M2iKmN1T-t8TTRqWnbrava1uuWF8V3DocOIQ0Vl862EmtQtHxOT7UOegS-Pck5bkC5jxl8Psuh1c-KKw1uVSoAMRHmo08474ajvRirMc1pofbmDq_1_quJQVkr4dOYsAIi7ZpS8xWW-N-5d7Hx-JIf6NNBZrimUJffs0gBsRz7Run8u1jkJIb02FFfbs0w1adUotuqzssaC8MALphenJub1GTlbwB9YJhCskL5qmz2VIh4Hm9IE2F3fof34BwVnbNhy4TWz8viJ1-gLWL2u53_Lc0Ai4GbYtDAyzLfEESfvi-2SIeElu5QX4cH7WgF5YWleXK7wPGT74fCM5C_Q9bB0=&vjs=3&p=4&sk=&fvj=0|"[We do research differently here at Google. Our team of Research Scientists aren't cloistered in a secret lab but are embedded throughout the engineering organization, allowing them to setup large-scale tests and deploy promising ideas quickly and broadly. Ideas may come from internal projects as well as from collaborations with research programs at partner universities and technical institutes all over the world. From creating experiments and prototyping implementations to designing new architectures, Research Scientists work on real-world problems including artificial intelligence, data mining, natural language processing, hardware and software performance analysis, improving compilers for mobile platforms, as well as core search and much more. But you stay connected to your research roots as an active contributor to the wider research community by partnering with universities and publishing papers.


You manage individual project priorities, deadlines, and deliverables, adapting to changes and setbacks in order to manage pressures, demonstrating and applying theories through research efforts to develop new and improved products, processes, or technologies.


Research and Machine Intelligence is a high impact team that’s building the next generation of intelligence and language understanding for all Google products. To achieve this, we’re working on projects that utilize the latest techniques in Artificial Intelligence, Machine Learning (including Deep Learning approaches like Google Brain) and Natural Language Understanding. Our work gets used by product teams across Google, including Search, Maps and Google Now.


As a Research Software Engineer in the Google Brain team, you work and collaborate closely with Research Scientists on the team. You have the flexibility to switch projects as our research focus shifts and evolves. We need our engineers to be versatile and passionate about managing new problems.


This role bridges the gap between Software Engineer and Research Scientist. We are looking for great software engineers who also have experience with language understanding and perception (speech, images, video) - as well as improving algorithms. We work with teams across Google to make their products better and make Moonshots possible. In this role, you'll work alongside world-class Research Scientists in the Google Brain team to bring their ideas to life by implementing algorithms, running experiments and building prototypes.


There is always more information out there, and the Research and Machine Intelligence team has a never-ending quest to find it and make it accessible. We're constantly refining our signature search engine to provide better results, and developing offerings like Google Instant, Google Voice Search and Google Image Search to make it faster and more engaging. We're providing users around the world with great search results every day, but at Google, great just isn't good enough. We're just getting started.


Responsibilities
Participate in cutting-edge research in artificial intelligence and machine learning applications.
Develop solutions for real-world, large-scale problems.

Qualifications
Minimum qualifications:
BA/BS degree in Computer Science, related technical field or equivalent practical experience.
Experience with one or more general purpose programming languages including but not limited to: C/C++ or Python
Experience with linear algebra, calculus and statistics
Machine learning experience

Preferred qualifications:
MS or PhD degree in Computer Science, Artificial Intelligence, Machine Learning, or related technical field.
Strong computer systems experience.
GPU programming experience.
Large data analysis and visualization experience.
Exposure to industry or academic research.
Exposure to Deep Learning, Neural Networks, or related fields and a strong interest and desire to learn about them.]"
5|New+York+NY|Data Scientist|YieldStreet|New York, NY 10017 (Midtown area)|We offer an attractive market salary, stock option plan, health & dental benefits, life insurance, 401(k), paid vacation and holidays and that's before you even...||https://www.indeed.com//rc/clk?jk=9de61a06124bf25d&fccid=ffe6f6da0af7627c&vjs=3|"[We’re working to change the way wealth is created.

YieldStreet is disrupting the trillion-dollar lending and investment industry. We recently raised $113M in financing from world-class venture capitalists to help us scale. Our investor demand is soaring, and our team is expected to double in size this year. Do you have what it takes to join a booming startup that is changing the investment industry?


About YieldStreet

YieldStreet connects investors to opportunities in alternative asset classes like real estate and litigation finance that were historically unavailable to most. YieldStreet was created because our founders were frustrated by the lack of options regular investors had to participate in asset backed investment opportunities that exist outside of the stock market.

We believe top notch technology and data can help us build the world’s most robust alternative investment platform and create financial independence for all. Join us.
About the Role
As our first data scientist you will be tasked with transforming our massive amounts of financial and user data into predictive models that will push the boundaries of the specialty finance industry.
What You’ll Do
Design and develop explanatory and predictive models from huge financial datasets to build an automated underwriting engine
Design and develop explanatory and predictive models from investor behavior to optimize marketing efforts
Partner with our marketing, product and investments team with special projects and experiments
Research new data sources and build proof of concepts
Partner with our engineering team to build and optimize data pipelines and feedback loops into the models
Build processes for ensuring integrity
Required Skills
We're on the hunt for someone that crunches numbers in their sleep, and loves finding needles in haystacks.
MS or PhD in a heavily quantitative field
2+ years of experience, including experience designing statistical models and research
Data Architecture and Management (PostgreSQL, Hadoop, Oracle, Hive, Spark, Redshift and/or SQL Server)
Machine Learning / AI (Decision trees, association rules, neural networks, inductive logic, clustering and classification, Bayesian networks, supervised or unsupervised learning)
Deep Statistical Modeling (R, numPy, Julia, Matlab, Stata, SAS)
Excellent spoken and written communication skills to convey complex concepts in simple terms to key stakeholders
Bonus Skills
Deep knowledge in finance and investing
Experience building financial models
Benefits
We offer an attractive market salary, stock option plan, health & dental benefits, life insurance, 401(k), paid vacation and holidays and that's before you even step in the office!
This is an opportunity to work with a group of diverse, smart, and friendly people from 8 different countries who speak a total of 17 different languages. Our team is comprised of successful entrepreneurs with combined exits of over $1B, and we get social with each other during happy hours in our work hard/play hard culture. Make sure you get to know Diver the fish, and help yourself to a variety of top tier scotch and whiskies at the company bar.
We're located in a beautiful new office in Midtown, our building is close to most major subway lines.
Please, no solicitors or recruiters. We're saving our dollars to pay the right candidate!]"
